{"contract_version":"1.1.0","identity":{"decision_id":"RSK-22222222222222222222222222222222","decision_key":"RDK-0000000000000000000000000000000000000000000000000000000000000000","subject_type":"FUSION","fusion_id":"FUS-11111111111111111111111111111111","fusion_key":"FUK-653931439FAF8B473B1D4980E483206DAF065DBECAD135A0BB9367089E588FCC","run_id":"RUN-11111111111111111111111111111111","coordinator_execution_id":"EXE-AAAAAAAAAAAAAAAAAAAAAAAAAAAAAAAA","round":1},"gate":{"proposed_action":"STOP_LINE","decision":"REQUIRE_APPROVAL","risk_level":"HIGH","approval_required":true,"allowed_actions":["HOLD_BATCH","ESCALATE"],"policy_refs":["policy:risk-v1"],"reason_codes":["STOP_LINE_REQUIRES_APPROVAL"],"confidence":0.95},"generated_at":"2026-08-20T01:00:00Z"}
